<?xml version="1.0" encoding="gb2312"?>
<!DOCTYPE Students SYSTEM "bin\\Lee\\com\\Students.dtd">
<Students>
	<Student>
		<Student_ID>001</Student_ID>
		<Student_Name>ÕÅÇì±ó</Student_Name>
		<Student_Sex>ÄÐ</Student_Sex>
		<Student_Age>20</Student_Age>
	</Student>
	<Student>
		<Student_ID>002</Student_ID>
		<Student_Name>ÈÎÊ÷Èº</Student_Name>
		<Student_Sex>ÄÐ</Student_Sex>
		<Student_Age>21</Student_Age>
	</Student>
	<Student>
		<Student_ID>003</Student_ID>
		<Student_Name>·ëºñ¿í</Student_Name>
		<Student_Sex>ÄÐ</Student_Sex>
		<Student_Age>21</Student_Age>
	</Student>
	<Student>
		<Student_ID>004</Student_ID>
		<Student_Name>Áõ±´±´</Student_Name>
		<Student_Sex>ÄÐ</Student_Sex>
		<Student_Age>21</Student_Age>
	</Student>
</Students>
